{
  "$schema": "./schemas/full-contract-coverage.schema.json",
  "formatVersion": 1,
  "bundle": "current-official.json",
  "sourceHashes": {
    "openapi": "091f171718a0376b0c1a2e9348b02b1ce003d0786dd04d772dd11005ca414bf4",
    "asyncapi": "eaf754def77f36cd016f1e852a5ce76f11b635140e879bee7a3f9cad40716f9f"
  },
  "counts": {
    "restOperations": 118,
    "channels": 15,
    "websocketOperations": 41,
    "channelMessages": 44,
    "componentMessages": 44,
    "schemas": 630,
    "references": 1184
  },
  "operations": [
    {
      "id": "UpgradeAccountApiUsageLevel",
      "contract": "current-official.json#/rest/0",
      "schemaAccounting": "complete",
      "disposition": {
        "operationId": "UpgradeAccountApiUsageLevel",
        "path": "/account/api_usage_level/upgrade",
        "method": "POST",
        "status": "unreviewed"
      },
      "effective": "present-in-source"
    },
    {
      "id": "GetAccountApiUsageLevelVolumeProgress",
      "contract": "current-official.json#/rest/1",
      "schemaAccounting": "complete",
      "disposition": {
        "operationId": "GetAccountApiUsageLevelVolumeProgress",
        "path": "/account/api_usage_level/volume_progress",
        "method": "GET",
        "status": "unreviewed"
      },
      "effective": "present-in-source"
    },
    {
      "id": "GetAccountEndpointCosts",
      "contract": "current-official.json#/rest/2",
      "schemaAccounting": "complete",
      "disposition": {
        "operationId": "GetAccountEndpointCosts",
        "path": "/account/endpoint_costs",
        "method": "GET",
        "status": "unreviewed"
      },
      "effective": "present-in-source"
    },
    {
      "id": "GetAccountApiLimits",
      "contract": "current-official.json#/rest/3",
      "schemaAccounting": "complete",
      "disposition": {
        "operationId": "GetAccountApiLimits",
        "path": "/account/limits",
        "method": "GET",
        "status": "unreviewed"
      },
      "effective": "present-in-source"
    },
    {
      "id": "GetApiKeys",
      "contract": "current-official.json#/rest/4",
      "schemaAccounting": "complete",
      "disposition": {
        "operationId": "GetApiKeys",
        "path": "/api_keys",
        "method": "GET",
        "status": "unreviewed"
      },
      "effective": "present-in-source"
    },
    {
      "id": "CreateApiKey",
      "contract": "current-official.json#/rest/5",
      "schemaAccounting": "complete",
      "disposition": {
        "operationId": "CreateApiKey",
        "path": "/api_keys",
        "method": "POST",
        "status": "unreviewed"
      },
      "effective": "present-in-source"
    },
    {
      "id": "GenerateApiKey",
      "contract": "current-official.json#/rest/6",
      "schemaAccounting": "complete",
      "disposition": {
        "operationId": "GenerateApiKey",
        "path": "/api_keys/generate",
        "method": "POST",
        "status": "unreviewed"
      },
      "effective": "present-in-source"
    },
    {
      "id": "DeleteApiKey",
      "contract": "current-official.json#/rest/7",
      "schemaAccounting": "complete",
      "disposition": {
        "operationId": "DeleteApiKey",
        "path": "/api_keys/{api_key}",
        "method": "DELETE",
        "status": "unreviewed"
      },
      "effective": "present-in-source"
    },
    {
      "id": "GetBlockTradeProposals",
      "contract": "current-official.json#/rest/8",
      "schemaAccounting": "complete",
      "disposition": {
        "operationId": "GetBlockTradeProposals",
        "path": "/communications/block-trade-proposals",
        "method": "GET",
        "status": "unreviewed"
      },
      "effective": "present-in-source"
    },
    {
      "id": "ProposeBlockTrade",
      "contract": "current-official.json#/rest/9",
      "schemaAccounting": "complete",
      "disposition": {
        "operationId": "ProposeBlockTrade",
        "path": "/communications/block-trade-proposals",
        "method": "POST",
        "status": "unreviewed"
      },
      "effective": "present-in-source"
    },
    {
      "id": "AcceptBlockTradeProposal",
      "contract": "current-official.json#/rest/10",
      "schemaAccounting": "complete",
      "disposition": {
        "operationId": "AcceptBlockTradeProposal",
        "path": "/communications/block-trade-proposals/{block_trade_proposal_id}/accept",
        "method": "POST",
        "status": "unreviewed"
      },
      "effective": "present-in-source"
    },
    {
      "id": "GetCommunicationsID",
      "contract": "current-official.json#/rest/11",
      "schemaAccounting": "complete",
      "disposition": {
        "operationId": "GetCommunicationsID",
        "path": "/communications/id",
        "method": "GET",
        "status": "unreviewed"
      },
      "effective": "present-in-source"
    },
    {
      "id": "GetQuotes",
      "contract": "current-official.json#/rest/12",
      "schemaAccounting": "complete",
      "disposition": {
        "operationId": "GetQuotes",
        "path": "/communications/quotes",
        "method": "GET",
        "status": "unreviewed"
      },
      "effective": "present-in-source"
    },
    {
      "id": "CreateQuote",
      "contract": "current-official.json#/rest/13",
      "schemaAccounting": "complete",
      "disposition": {
        "operationId": "CreateQuote",
        "path": "/communications/quotes",
        "method": "POST",
        "status": "unreviewed"
      },
      "effective": "present-in-source"
    },
    {
      "id": "DeleteQuote",
      "contract": "current-official.json#/rest/14",
      "schemaAccounting": "complete",
      "disposition": {
        "operationId": "DeleteQuote",
        "path": "/communications/quotes/{quote_id}",
        "method": "DELETE",
        "status": "unreviewed"
      },
      "effective": "present-in-source"
    },
    {
      "id": "GetQuote",
      "contract": "current-official.json#/rest/15",
      "schemaAccounting": "complete",
      "disposition": {
        "operationId": "GetQuote",
        "path": "/communications/quotes/{quote_id}",
        "method": "GET",
        "status": "unreviewed"
      },
      "effective": "present-in-source"
    },
    {
      "id": "AcceptQuote",
      "contract": "current-official.json#/rest/16",
      "schemaAccounting": "complete",
      "disposition": {
        "operationId": "AcceptQuote",
        "path": "/communications/quotes/{quote_id}/accept",
        "method": "PUT",
        "status": "unreviewed"
      },
      "effective": "present-in-source"
    },
    {
      "id": "ConfirmQuote",
      "contract": "current-official.json#/rest/17",
      "schemaAccounting": "complete",
      "disposition": {
        "operationId": "ConfirmQuote",
        "path": "/communications/quotes/{quote_id}/confirm",
        "method": "PUT",
        "status": "unreviewed"
      },
      "effective": "present-in-source"
    },
    {
      "id": "GetRFQs",
      "contract": "current-official.json#/rest/18",
      "schemaAccounting": "complete",
      "disposition": {
        "operationId": "GetRFQs",
        "path": "/communications/rfqs",
        "method": "GET",
        "status": "unreviewed"
      },
      "effective": "present-in-source"
    },
    {
      "id": "CreateRFQ",
      "contract": "current-official.json#/rest/19",
      "schemaAccounting": "complete",
      "disposition": {
        "operationId": "CreateRFQ",
        "path": "/communications/rfqs",
        "method": "POST",
        "status": "unreviewed"
      },
      "effective": "present-in-source"
    },
    {
      "id": "DeleteRFQ",
      "contract": "current-official.json#/rest/20",
      "schemaAccounting": "complete",
      "disposition": {
        "operationId": "DeleteRFQ",
        "path": "/communications/rfqs/{rfq_id}",
        "method": "DELETE",
        "status": "unreviewed"
      },
      "effective": "present-in-source"
    },
    {
      "id": "GetRFQ",
      "contract": "current-official.json#/rest/21",
      "schemaAccounting": "complete",
      "disposition": {
        "operationId": "GetRFQ",
        "path": "/communications/rfqs/{rfq_id}",
        "method": "GET",
        "status": "unreviewed"
      },
      "effective": "present-in-source"
    },
    {
      "id": "DeleteRFQQuote",
      "contract": "current-official.json#/rest/22",
      "schemaAccounting": "complete",
      "disposition": {
        "operationId": "DeleteRFQQuote",
        "path": "/communications/rfqs/{rfq_id}/quotes/{quote_id}",
        "method": "DELETE",
        "status": "unreviewed"
      },
      "effective": "present-in-source"
    },
    {
      "id": "GetRFQQuote",
      "contract": "current-official.json#/rest/23",
      "schemaAccounting": "complete",
      "disposition": {
        "operationId": "GetRFQQuote",
        "path": "/communications/rfqs/{rfq_id}/quotes/{quote_id}",
        "method": "GET",
        "status": "unreviewed"
      },
      "effective": "present-in-source"
    },
    {
      "id": "AcceptRFQQuote",
      "contract": "current-official.json#/rest/24",
      "schemaAccounting": "complete",
      "disposition": {
        "operationId": "AcceptRFQQuote",
        "path": "/communications/rfqs/{rfq_id}/quotes/{quote_id}/accept",
        "method": "PUT",
        "status": "unreviewed"
      },
      "effective": "present-in-source"
    },
    {
      "id": "ConfirmRFQQuote",
      "contract": "current-official.json#/rest/25",
      "schemaAccounting": "complete",
      "disposition": {
        "operationId": "ConfirmRFQQuote",
        "path": "/communications/rfqs/{rfq_id}/quotes/{quote_id}/confirm",
        "method": "PUT",
        "status": "unreviewed"
      },
      "effective": "present-in-source"
    },
    {
      "id": "GetEvents",
      "contract": "current-official.json#/rest/26",
      "schemaAccounting": "complete",
      "disposition": {
        "operationId": "GetEvents",
        "path": "/events",
        "method": "GET",